{
  "$schema": "https://json-schema.org/draft/2020-12/schema",
  "title": "Cafe Menu to HTML example structure",
  "description": "Structural guide to the supplied example. Runtime validation enforces supported states, publication gates and cross-field rules.",
  "type": "object",
  "properties": {
    "cafe": {
      "type": "string"
    },
    "updatedOn": {
      "type": "string"
    },
    "currency": {
      "type": "string"
    },
    "items": {
      "type": "array",
      "items": {
        "type": "object",
        "properties": {
          "id": {
            "type": "string"
          },
          "category": {
            "type": "string"
          },
          "item": {
            "type": "string"
          },
          "description": {
            "type": "string"
          },
          "price": {
            "type": "string"
          },
          "available": {
            "type": "boolean"
          },
          "dietary_note": {
            "type": "string"
          }
        },
        "required": [
          "id",
          "category",
          "item",
          "description",
          "price",
          "available",
          "dietary_note"
        ]
      }
    }
  },
  "required": [
    "cafe",
    "updatedOn",
    "currency",
    "items"
  ]
}
