{
  "cafe": "The Willow Counter / fictional cafe",
  "updatedOn": "2026-10-23",
  "currency": "GBP",
  "items": [
    {
      "id": "coffee-1",
      "category": "Coffee",
      "item": "Flat white",
      "description": "Two sizes, made to order.",
      "price": "3.20",
      "available": true,
      "dietary_note": "Ask the cafe about available milk options."
    },
    {
      "id": "coffee-2",
      "category": "Coffee",
      "item": "Large flat white",
      "description": "The larger size.",
      "price": "3.70",
      "available": true,
      "dietary_note": ""
    },
    {
      "id": "breakfast-1",
      "category": "Breakfast",
      "item": "Roasted mushrooms on toasted sourdough with seasonal leaves",
      "description": "An example of a long item name that should wrap without losing its price.",
      "price": "8.50",
      "available": true,
      "dietary_note": "Speak to staff about dietary requirements."
    },
    {
      "id": "cake-1",
      "category": "Cakes",
      "item": "Seasonal cake",
      "description": "Updated by the cafe when the selection changes.",
      "price": "",
      "available": false,
      "dietary_note": "Ingredients vary. Ask staff before ordering."
    }
  ]
}
